{
  "genome_schema": 1,
  "revision": {
    "id": "sha256:f1497c5f1f31121a220789dd5727d729602af0cd373ce2d3c5eb1e544094cf6b",
    "seq": 1,
    "bot": {
      "owner_id": "user_owner_5",
      "bot_id": "bot_123"
    },
    "parent": null,
    "created_by": {
      "kind": "user",
      "actor": "user_owner_5"
    },
    "created_at": "2026-10-18T09:00:00Z",
    "status": "draft",
    "patch_digest": null,
    "evidence": [],
    "evaluations": [],
    "annotations": {}
  },
  "spec": {
    "persona": [],
    "skills": [],
    "memory": null,
    "resources": [],
    "tools": {
      "mcp": []
    },
    "engine_config": {},
    "script": null
  },
  "policy": {
    "mutable_genes": [
      "memory",
      "persona",
      "resources",
      "skills"
    ],
    "pins": [
      "persona/SAFETY.md"
    ],
    "risk_overrides": {}
  }
}
