{
  "genome_schema": 1,
  "revision": {
    "id": "sha256:22755f072e4c98e18595150e6ac125eb3300274ab668c37b731cc1bfd9cd3196",
    "seq": 3,
    "bot": {
      "owner_id": "user_owner_5",
      "bot_id": "bot_123"
    },
    "parent": null,
    "created_by": {
      "kind": "user",
      "actor": "user_owner_5"
    },
    "created_at": "2026-10-05T10:00:00Z",
    "status": "draft",
    "patch_digest": null,
    "evidence": [],
    "evaluations": [],
    "annotations": {}
  },
  "spec": {
    "persona": [
      {
        "type": "SOUL.md",
        "digest": "sha256:2c17cb810922de1a38d4bc036cb547cfc8a27b398ce000527737e64168141a5f"
      }
    ],
    "skills": [],
    "memory": {
      "mode": "seed",
      "items_digest": "sha256:70f30cbc4b1604d76c389d38be4900825ba3595c4798435f65c19f0704d56197"
    },
    "resources": [],
    "tools": {
      "mcp": []
    },
    "engine_config": {},
    "script": null
  },
  "policy": {
    "mutable_genes": [
      "memory",
      "persona/SOUL.md"
    ],
    "pins": [],
    "risk_overrides": {
      "persona/SOUL.md": "T3"
    }
  }
}
