{
  "genome_schema": 1,
  "revision": {
    "id": "sha256:3c21a8674d2025b934417bee0773634dfdc44398dbe4d1714a10c7884263657d",
    "seq": 1,
    "bot": {
      "owner_id": "user_owner_5",
      "bot_id": "bot_123"
    },
    "parent": null,
    "created_by": {
      "kind": "user",
      "actor": "user_owner_5"
    },
    "created_at": "2026-10-18T09:00:00Z",
    "status": "draft",
    "patch_digest": null,
    "evidence": [],
    "evaluations": [],
    "annotations": {}
  },
  "spec": {
    "persona": [],
    "skills": [],
    "memory": null,
    "resources": [
      {
        "path": "data/archive/",
        "digest": "sha256:4d65ef977119d90da4256ca1b066c5ed60ea4d06666e9cc0b91fde20472766a1"
      },
      {
        "path": "data/kb/",
        "digest": "sha256:a00d9b26f594057747609ac5c1bdacb38bb42641b41b3cf5d0d36c13b4a47ce0"
      }
    ],
    "tools": {
      "mcp": []
    },
    "engine_config": {},
    "script": null
  },
  "policy": {
    "mutable_genes": [
      "memory",
      "persona",
      "resources",
      "skills"
    ],
    "pins": [
      "persona/SAFETY.md"
    ],
    "risk_overrides": {}
  }
}
