{
  "genome_schema": 1,
  "revision": {
    "id": "sha256:a2f0862c46848c05e502c672d0e07b2f72bc380a53506ac9faff71998ceba767",
    "seq": 1,
    "bot": {
      "owner_id": "user_owner_5",
      "bot_id": "bot_123"
    },
    "parent": null,
    "created_by": {
      "kind": "user",
      "actor": "user_owner_5"
    },
    "created_at": "2026-10-18T09:00:00Z",
    "status": "draft",
    "patch_digest": null,
    "evidence": [],
    "evaluations": [],
    "annotations": {}
  },
  "spec": {
    "persona": [
      {
        "type": "RULES.md",
        "digest": "sha256:6d829d683523eaa904276c2fdee3f30626dd87621f62584e005cc4b1b85e5f8c"
      },
      {
        "type": "SAFETY.md",
        "digest": "sha256:7d8668bfe8d5dc68864e66cfb61688a3763fc550ee4eafe5b2b42023dfd0652f"
      },
      {
        "type": "SOUL.md",
        "digest": "sha256:6617cb3cf941478561d38b0d95d58495f1193a505a1b6fff2807a946479877cf"
      }
    ],
    "skills": [],
    "memory": null,
    "resources": [],
    "tools": {
      "mcp": []
    },
    "engine_config": {},
    "script": null
  },
  "policy": {
    "mutable_genes": [
      "memory",
      "persona",
      "resources",
      "skills"
    ],
    "pins": [
      "persona/SAFETY.md"
    ],
    "risk_overrides": {}
  }
}
