{
  "genome_schema": 1,
  "revision": {
    "id": "sha256:9e21ea360e6d4bdb63a151d280a7f1802402a8294b5033c92239731bd1e8d1fe",
    "seq": 41,
    "bot": {
      "owner_id": "user_owner_5",
      "bot_id": "bot_123"
    },
    "parent": null,
    "created_by": {
      "kind": "user",
      "actor": "user_owner_5"
    },
    "created_at": "2026-10-01T09:30:00Z",
    "status": "promoted",
    "patch_digest": null,
    "evidence": [],
    "evaluations": [],
    "annotations": {}
  },
  "spec": {
    "persona": [
      {
        "type": "AGENTS.md",
        "digest": "sha256:805cb58a376ea4ae2ae21f553a9ed38f0154f1ce0475193397d5cbde1d8ff9cb"
      },
      {
        "type": "RULES.md",
        "digest": "sha256:223913de5dee2f6d1761cf42c7f396ca57a4422390534b0dbc3ecf1190996753"
      },
      {
        "type": "SAFETY.md",
        "digest": "sha256:8b681c5faae2856870c53cf8626c9974c7490d6da8ffeae1c26d5324e8843c01"
      },
      {
        "type": "SOUL.md",
        "digest": "sha256:5013aec5c223f8e4feaebd88d4607fec71e7cb6c18f5bd0e2aa235b8d05d6fa7"
      }
    ],
    "skills": [
      {
        "name": "quality-check",
        "origin": "local",
        "digest": "sha256:d52d71d4b705848aa85ecc83f7b73eeb4d955f0b47c6dc4ecf1b81f2ea000073"
      },
      {
        "name": "refund-policy",
        "origin": "center",
        "center_version": "v7"
      }
    ],
    "memory": null,
    "resources": [
      {
        "path": "data/faq.csv",
        "digest": "sha256:a5d2be13ca810cd6cb138660cf6809166c1f9e4ca2f422dc73ff2ed8c26358b5"
      },
      {
        "path": "data/kb/",
        "digest": "sha256:e991fc5f15ad73a39edc8e2dac63fb31fa9a6d025289cffe7800de866ecdccce"
      }
    ],
    "tools": {
      "mcp": [
        {
          "server_code": "mcp.x.meet",
          "config": {
            "endpoint_env": "PRE",
            "headers": {
              "X-Project": "support"
            },
            "transport_protocol": "STREAMABLE_HTTP",
            "url": "https://meet.example.com/mcp"
          }
        },
        {
          "server_code": "mcp.x.orders"
        }
      ]
    },
    "engine_config": {},
    "script": {
      "digest": "sha256:95addf01732ce8a33538041ba640b7195e00fc9f20055149354452b309d61fb2"
    }
  },
  "policy": {
    "mutable_genes": [
      "memory",
      "persona",
      "resources",
      "skills"
    ],
    "pins": [
      "persona/SAFETY.md"
    ],
    "risk_overrides": {}
  }
}
