{
  "genome_schema": 1,
  "revision": {
    "id": "sha256:84abd5007f7fabf48214a9cb45b2face36f9b9616de51da2c9ba36ffdbc50cc3",
    "seq": 1,
    "bot": {
      "owner_id": "user_owner_5",
      "bot_id": "bot_123"
    },
    "parent": null,
    "created_by": {
      "kind": "user",
      "actor": "user_owner_5"
    },
    "created_at": "2026-10-18T09:00:00Z",
    "status": "draft",
    "patch_digest": null,
    "evidence": [],
    "evaluations": [],
    "annotations": {}
  },
  "spec": {
    "persona": [],
    "skills": [],
    "memory": null,
    "resources": [
      {
        "path": "data/faq.csv",
        "digest": "sha256:4fd6ec587a950260a8b4be21a758efa607804df5336e4c0878770239ced33ee7"
      },
      {
        "path": "data/kb/",
        "digest": "sha256:a00d9b26f594057747609ac5c1bdacb38bb42641b41b3cf5d0d36c13b4a47ce0"
      }
    ],
    "tools": {
      "mcp": []
    },
    "engine_config": {},
    "script": null
  },
  "policy": {
    "mutable_genes": [
      "memory",
      "persona",
      "resources",
      "skills"
    ],
    "pins": [
      "persona/SAFETY.md"
    ],
    "risk_overrides": {}
  }
}
